{
"meta": {
"formatVersion": 2,
"source": "prgs-vnext2-columnar"
},
"project": {
"datesaved": "2026-02-24",
"timesaved": "22:06",
"name": "BridgeRehab",
"startup": "",
"markerLabel": "Original Complete",
"labelToggle": "true",
"legendBaselineCheckbox": "true",
"legendPlannedCheckbox": "true",
"legendActualCheckbox": "true",
"legendForecastCheckbox": "true"
},
"scopes": {
"scopeId": [
"sc001",
"sc002",
"sc003",
"sc004",
"sc005",
"sc006",
"sc007",
"sc008",
"sc009",
"sc010",
"sc011",
"sc012",
"sc013"
],
"label": [
"Mobilization",
"TrafficControl",
"AccessScaffolding",
"SubstructureRepair",
"BearingReplacement",
"GirderRepair",
"CrossframeRepair",
"DeckRemoval",
"DeckPatching",
"Waterproofing",
"PavingStriping",
"OpenToTraffic",
"Demobilization"
],
"start": [
"",
"",
"",
"",
"",
"",
"",
"",
"",
"",
"",
"",
""
],
"end": [
"",
"",
"",
"",
"",
"",
"",
"",
"",
"",
"",
"",
""
],
"cost": [
3,
10,
5,
15,
8,
15,
6,
8,
12,
5,
6,
4,
3
],
"progressValue": [
"",
"",
"",
"",
"",
"",
"",
"",
"",
"",
"",
"",
""
],
"unitsToDate": [
"",
"",
"",
"",
"",
"",
"",
"",
"",
"",
"",
"",
""
],
"totalUnits": [
"",
"",
"",
"",
"",
"",
"",
"",
"",
"",
"",
"",
""
],
"unitsLabel": [
"%",
"%",
"%",
"%",
"%",
"%",
"%",
"%",
"%",
"%",
"%",
"%",
"%"
],
"sectionName": [
"Setup",
"Setup",
"Setup",
"Substructure",
"Substructure",
"Superstructure",
"Superstructure",
"Deck",
"Deck",
"Deck",
"Deck",
"Closeout",
"Closeout"
],
"sectionID": [
"secSetup01",
"secSetup01",
"secSetup01",
"secSubstructure01",
"secSubstructure01",
"secSuperstructure01",
"secSuperstructure01",
"secDeck01",
"secDeck01",
"secDeck01",
"secDeck01",
"secCloseout01",
"secCloseout01"
]
},
"timeseries": {
"project": {
"date": [],
"baselinePct": [],
"plannedPct": [],
"dailyActual": [],
"actualPct": []
},
"projectMeta": {
"historyDate": [],
"key": [],
"value": []
},
"scopes": {
"historyDate": [],
"scopeId": [],
"label": [],
"start": [],
"end": [],
"cost": [],
"perDay": [],
"actualPct": [],
"unitsToDate": [],
"totalUnits": [],
"unitsLabel": [],
"plannedtodate": [],
"sectionName": [],
"sectionID": []
},
"sections": {
"historyDate": [],
"sectionID": [],
"sectionTitle": [],
"sectionWeight": [],
"sectionPct": [],
"sectionPlannedPct": []
}
}
}
