{
  "meta": {
    "formatVersion": 2,
    "source": "prgs-vnext2-columnar"
  },
  "project": {
    "datesaved": "2026-02-24",
    "timesaved": "21:05",
    "name": "<Project Name>",
    "startup": "",
    "markerLabel": "Original Complete",
    "labelToggle": "true",
    "legendBaselineCheckbox": "true",
    "legendPlannedCheckbox": "true",
    "legendActualCheckbox": "true",
    "legendForecastCheckbox": "true"
  },
  "scopes": {
    "scopeId": [
      "sc_frkl20",
      "sc_dtfs3n",
      "sc_kf6453",
      "sc_wddmap",
      "sc_tyqoiy"
    ],
    "label": [
      "Scope #1",
      "Scope #2",
      "Scope #3",
      "Scope #4",
      "Scope #5"
    ],
    "start": [
      "",
      "",
      "",
      "",
      ""
    ],
    "end": [
      "",
      "",
      "",
      "",
      ""
    ],
    "cost": [
      20,
      20,
      20,
      20,
      20
    ],
    "progressValue": [
      0,
      0,
      0,
      0,
      0
    ],
    "unitsToDate": [
      "",
      "",
      "",
      "",
      ""
    ],
    "totalUnits": [
      "",
      "",
      "",
      "",
      ""
    ],
    "unitsLabel": [
      "%",
      "%",
      "%",
      "%",
      "%"
    ],
    "sectionName": [
      "Section #1",
      "Section #1",
      "Section #1",
      "Section #2",
      "Section #2"
    ],
    "sectionID": [
      "sec_8bd783",
      "sec_8bd783",
      "sec_8bd783",
      "sec_831d14",
      "sec_831d14"
    ]
  },
  "timeseries": {
    "project": {
      "date": [
        "2025-11-14",
        "2025-11-15",
        "2025-11-16",
        "2025-11-17",
        "2025-11-18",
        "2025-11-19",
        "2025-11-20",
        "2025-11-21",
        "2025-11-22"
      ],
      "baselinePct": [
        0,
        12.5,
        25,
        37.5,
        50,
        62.5,
        75,
        87.5,
        100
      ],
      "plannedPct": [
        0,
        0,
        0,
        0,
        0,
        0,
        0,
        0,
        0
      ],
      "dailyActual": [
        "",
        "",
        "",
        "",
        "",
        "",
        "",
        "",
        ""
      ],
      "actualPct": [
        "",
        "",
        "",
        "",
        "",
        "",
        "",
        "",
        ""
      ]
    },
    "projectMeta": {
      "historyDate": [],
      "key": [],
      "value": []
    },
    "scopes": {
      "historyDate": [],
      "scopeId": [],
      "label": [],
      "start": [],
      "end": [],
      "cost": [],
      "perDay": [],
      "actualPct": [],
      "unitsToDate": [],
      "totalUnits": [],
      "unitsLabel": [],
      "plannedtodate": [],
      "sectionName": [],
      "sectionID": []
    },
    "sections": {
      "historyDate": [],
      "sectionID": [],
      "sectionTitle": [],
      "sectionWeight": [],
      "sectionPct": [],
      "sectionPlannedPct": []
    }
  }
}
